,Subject,Assignment,Status,Time,Priority,Start date,Due on
,,,,,,,
,,,,,,,
,,What you can cram into a single $&!#* vector: Probing sentence embeddings for linguistic properties (Marco Baroni),,,,,
,,Reasoning about Actions and State Changes by Injecting Commonsense Knowledge (EMNLP 18),,,,,
,,Neural Network Acceptability Judgments - S. Bowman,Done,,Important,,
,,"Identifying Well-formed Natural Language Questions - Manaal Faruqi, EMNLP 18",,,,,
,,Learning General Purpose Distributed Sentence Representations via Large Scale Multi-task Learning - Bengio,,,,,
,,Improving Language Understanding by Generative Pre-Training - I. Sutskever,,,,,
,,"[Linguistics] Grammaticality, Acceptibility and Probability - A.Clark",,,,,
,,Learning Neural Templates for Text Generation - Alexander Rush,,,,,
,,"Variational Autoencoder for Semi-supervised Text Classification - Xu, Sun, Deng, Tan",,,Important,,
,,"SeqGAN: Sequence Generative Adversarial Nets with Policy Gradient - Lantao Yu, Weinan Zhang, Jun Wang, Yong Yu",Done,,High,,
,,"Improved Semantic Representations From Tree-Structured Long Short-Term Memory Networks - Kai Sheng Tai, Richard Socher, Christopher D. Manning ",,,High,,
,,Connecting the Dots Between MLE and RL for Sequence Generation - R. Salakhutdinov,,,High,,
,,A Hybrid Convolutional Variational Autoencoder for Text Generation,Done,,Important,,
,,BERT: Pre-training of Deep Bidirectional Transformers for Language Understanding,Done,,Important,,
,,Towards Controlled Generation of Text,,,,,
,,"Recurrent Neural Network Grammars - Chris Dyer, NAACL 2016",,,,,
,,Analysis Methods in Neural Language Processing: A Survey (TACL 2019),,,Important,,
,,"ELMo - Deep contextualized word representations - Peter, Gardner, NAACL-HLT",Done,,High,,
,,Bidirectional LSTM-CRF Models for Sequence Tagging - BI-LSTM-CRF POS tagging,,,High,,
,,Character-level Convolutional Networks for Text Classification -  Lecunn - NIPS 15,,,,,
,,Google's Multilingual Neural Machine Translation System: Enabling Zero-Shot Translation - Jeff. Dean,,,,,
,,Learning and Evaluating General Linguistic Intelligence - Dani Yogatama,,,Important,,
,NLI,Neural Natural Language Inference Models Enhanced with External Knowledge - ACL 18,,,,,
,,"Colorless green recurrent networks dream hierarchically - Linzen, NAACL 2018",,,High,,
,,A Decomposable Attention Model for Natural Language Inference - Parikh et al,,,High,,
,,Enhanced LSTM for Natural Language Inference - ACL 2017,Done,,,,
,,Discrete Autoencoders for Sequence Models - Kaiser et al,,,Important,,
,,Challenges with Variational Autoencoders for Text - Vani et al.,,,Important,,
,,Improved Variational Autoencoders for Text Modeling using Dilated Convolutions - R. Salakhutdinov,,,Important,,
,,Transformer-XL: Attentive Language Models Beyond a Fixed-Length Context - Salakhutdinov,,,,,
,,A Hierarchical Attention Retrieval Model for Healthcare Question Answering - WWW 19,,,High,,
,,Improving Question Answering with External Knowledge - Arxiv Preprint,Done,,,,
,,BERT Rediscovers the Classical NLP Pipeline - Ian Tenney,Done,,,,
,ACL 2019,Adaptive Attention Span in Transformers,,,,,
,ACL 2019,"Analyzing Multi-Head Self-Attention: Specialized Heads Do the Heavy Lifting, the Rest Can Be Pruned",,,,,
,,,,,,,
,,Language Models are Unsupervised Multitask Learners - Ilya Sutskever (OpenAI GPT-2),Done,,Important,,
,,Improving language understanding by generative pre-training - Radford et al (GPT-I),,,Important,,
,,Transformer-XL: Attentive Language Models Beyond a Fixed-Length Context - R. Salakhutdinov,Done,,Important,,
,ACL 2019,Incorporating Syntactic and Semantic Information in Word Embeddings using Graph Convolutional Networks - Talukdar,,,High,,
,ACL 2019,"Self-Supervised Learning for Contextualized Extractive Summarization
 ",,,High,,
,,Deep Adversarial Learning for NLP - W.Wang (Tutorial NAACL 2019),In progress,,Important,,
,,stochastic neighbor embedding - Hinton,,,,,
,,Visualizing Data using t-SNE - Hinton (JMLR),,,,,
,NAACL 2019,Unifying Human and Statistical Evaluation forNatural Language Generation - Hashimoto,,,Important,,
,NAACL 2019,The Curious Case of Neural Text Degeneration - Holtzmann,Done,,Important,,
,,Beyond BLEU: Training Neural Machine Translation with Semantic Similarity. Wieting et al. 2019,,,Important,,
,ACL 2016,Minimum Risk Training for Neural Machine Translation - Shen et al,,,High,,
,EMNLP 2017,Adversarial Training for Relation Extraction - Russell et al,,,,,
,,XLNet,Done,,Important,,
,,"Avoiding Reasoning Shortcuts: Adversarial Evaluation, Training, and Model Development for Multi-Hop QA - Mohit Bansal",,,,,
,,Syntax-Infused Variational Autoencoder for Text Generation - L. Carin,,,,,
,,Explain Yourself! Leveraging Language Models for Commonsense Reasoning - R. Socher,,,Important,,
,,SHAPED: Shared-Private Encoder-Decoder for Text Style Adaptation - Ye Zhang,,,High,,
,,"Multilingual Neural Machine Translation With Soft Decoupled Encoding - Neubig, ICLR 2019",,,High,,
,,"A Decomposable Attention Model for Natural Language Inference - Parikh et al, EMNLP 2016",,,,,
,,Analyzing the Structure of Attention in a Transformer Language Model - Vig et al.,,,High,,
,,Deep Bayesian Natural Language Processing (acl tUTORIAL),,,,,
,,NEURAL TEXT GENERATION WITH UNLIKELIHOOD TRAINING - J. Weston,Done,,Important,,
,,"Pathologies of Neural Models Make Interpretations Difficult - Shi Feng, EMNLP 2018",,,Important,,
,,"A SIMPLE BUT TOUGH-TO-BEAT BASELINE FOR SENTENCE EMBEDDINGS
 - S. Arora et al",,,,,
,ACL 2019,"A Lightweight Recurrent Network for Sequence Modeling
 - ACL 2019",,,,,
,,Latent Relation Language Models - G.Neubig (EMNLP/ACL 2019),,,,,
,,Discourse Based Objectives for Fast unsupervised sentence representation learning - Bowman et al.,Done,,Important,,
,NAACL 19,Generating Text through Adversarial Training using Skip-Thought Vectors,,,Important,,
,,DisSent: Sentence Representation Learning from Explicit Discourse Relations - FAIR,,,Important,,
,,ERNIE: Enhanced Representation through Knowledge Integration,,,Important,,
,ICLR 19,Representation Degeneration Problem in Training Natural Language Generation Models - Gao et al,Done,,Important,,
,EMNLP 2019,Implicit Deep Latent Variable Models for Text Generation - Jianfeng Gao,,,Important,,
,,ELECTRA: Pre-training Text Encoders as Discriminators Rather Than Generators,,,,,
,,"Universal Adversarial Triggers for Attacking and Analyzing NLP
 - Matt Gardner",,,,,
,,"Are Sixteen Heads Really Better than One?
 - G. Neubig",,,,,
,,Unified Language Model Pre-training for Natural Language Understanding and Generation - Jianfeng Gao,Done,,Important,,
,,Dual Supervised Learning for Natural Language Understanding and Generation - ACL 2019,,,Important,,
,,What Does This Word Mean? Explaining Contextualized Embeddings with Natural Language Definition - EMNLP 2019,,,,,
,,Evaluating the Factual Consistency of Abstractive Text Summarization - R. Socher,,,High,,
,,"How Contextual are Contextualized Word Representations? Comparing the Geometry of BERT, ELMo, and GPT-2 Embeddings - KE",Done,,High,,
,,Exploring the Limits of Transfer Learning with aUnified Text-to-Text Transformer - Noam Shazeer,,,,,
,,"Spherical Latent Spaces for Stable Variational Autoencoders
 -  EMNLP 2018",,,Important,,